{
  "$id": "https://schema.opencerts.io/transcripts/3.0",
  "$schema": "http://json-schema.org/draft-07/schema#",
  "title": "Transcript (W3C Verifiable Credential)",
  "description": "W3C Verifiable Credentials Data Model 2.0 representation of an OpenCerts transcript, for use with the TrustVC (@trustvc/trustvc) library.",
  "type": "object",
  "definitions": {
    "issuer": {
      "description": "W3C VC issuer: a URI/DID string, or an object describing the issuing organisation. Replaces the OpenAttestation \"issuers\" array. The W3C VC v2 context marks \"issuer\" as @protected, so context.json declares these as top-level terms rather than scoping them under \"issuer\".",
      "oneOf": [
        { "type": "string", "format": "uri" },
        {
          "type": "object",
          "properties": {
            "id": {
              "type": "string",
              "format": "uri",
              "description": "DID or URL identifying the issuer; replaces the OpenAttestation issuer \"did\"",
              "examples": ["did:web:opencerts.io:blockchain-academy"]
            },
            "name": { "type": "string", "examples": ["Blockchain Academy"] },
            "url": { "type": "string", "examples": ["https://blockchainacademy.com"] },
            "email": { "type": "string", "examples": ["registrar@blockchainacademy.com"] },
            "phone": { "type": "string" }
          },
          "required": ["id", "name"],
          "additionalProperties": false
        }
      ]
    },
    "credentialSubject": {
      "type": "object",
      "description": "The transcript data.",
      "properties": {
        "id": {
          "type": "string",
          "description": "identifier of the recipient (DID/URL), when known"
        },
        "type": {
          "description": "the credential subject type; must be (or include) \"Transcript\", because context.json defines the transcript terms inside that type-scoped @context",
          "oneOf": [
            { "const": "Transcript" },
            {
              "type": "array",
              "items": { "type": "string" },
              "contains": { "const": "Transcript" }
            }
          ]
        },
        "name": {
          "type": "string",
          "description": "name of the qualification",
          "examples": ["Master of Blockchain"]
        },
        "description": { "type": "string" },
        "admissionDate": { "type": "string", "format": "date-time" },
        "graduationDate": {
          "type": "string",
          "format": "date-time",
          "description": "The date that this student graduated from the course"
        },
        "attainmentDate": {
          "type": "string",
          "format": "date-time",
          "description": "The date that this qualification was awarded to the recipient"
        },
        "recipient": {
          "type": "object",
          "description": "information about the person that is receiving the transcript",
          "properties": {
            "name": { "type": "string", "examples": ["Mr Blockchain"] },
            "did": { "type": "string" },
            "url": { "type": "string" },
            "email": { "type": "string" },
            "phone": { "type": "string" },
            "nric": { "type": "string" },
            "fin": { "type": "string" },
            "studentId": { "type": "string" }
          },
          "required": ["name"],
          "additionalProperties": false
        },
        "qualificationLevel": {
          "type": "array",
          "description": "This is an array of objects used to attach descriptors from frameworks such as Singapore's SSEC-EQA or the internationally recognised ISCED. Multiple instances are allowed to indicate either equivalents or to indicate a multi-level qualifications",
          "items": {
            "type": "object",
            "required": ["frameworkName", "frameworkVersion", "code", "description"],
            "additionalProperties": false,
            "properties": {
              "frameworkName": {
                "type": "string",
                "examples": ["singapore/ssec-eqa", "international/isced"]
              },
              "frameworkVersion": { "type": "string", "examples": ["2015", "2011"] },
              "code": { "type": "string", "examples": ["51", "55"] },
              "description": {
                "type": "string",
                "examples": [
                  "Polytechnic Diploma",
                  "(Short-cycle tertiary education) Vocational"
                ]
              }
            }
          }
        },
        "fieldOfStudy": {
          "type": "array",
          "description": "This is an array of objects used to attach descriptors from frameworks such as Singapore's SSEC-FOS or the internationally recognised ISCED-F. Multiple instances are allowed to indicate either equivalents or to indicate a multi-field qualification such as double degrees",
          "items": {
            "type": "object",
            "required": ["frameworkName", "frameworkVersion", "code", "description"],
            "additionalProperties": false,
            "properties": {
              "frameworkName": {
                "type": "string",
                "description": "Prepend the actual framework name with the scope of the framework",
                "examples": ["singapore/ssec-fos", "international/isced-f"]
              },
              "frameworkVersion": { "type": "string", "examples": ["2015", "2013"] },
              "code": { "type": "string", "examples": ["0897"] },
              "description": { "type": "string", "examples": ["Biomedical Science"] }
            }
          }
        },
        "cumulativeScore": { "type": "number" },
        "transcript": {
          "type": "array",
          "items": {
            "type": "object",
            "properties": {
              "name": { "type": "string" },
              "score": { "type": ["number", "string"] },
              "grade": { "type": ["number", "string"] },
              "courseCredit": { "type": ["number", "string"] },
              "courseCode": { "type": "string" },
              "examinationDate": { "type": "string", "format": "date-time" },
              "url": { "type": "string" },
              "description": { "type": "string" },
              "languageMedium": {
                "description": "Language that the course was undertaken in",
                "type": "string"
              }
            },
            "required": ["name"],
            "additionalProperties": false
          }
        },
        "additionalData": { "type": "object" },
        "skills": {
          "description": "Information about skills that the recipient learnt",
          "type": "array",
          "items": {
            "type": "object",
            "properties": {
              "frameworkUri": {
                "description": "URI where to find the details about the framework",
                "type": "string",
                "format": "uri",
                "examples": ["https://www.skillsfuture.sg/skills-framework"]
              },
              "frameworkName": {
                "description": "Framework name",
                "type": "string",
                "examples": ["SFw"]
              },
              "frameworkVersion": {
                "description": "Framework version",
                "type": "string",
                "examples": ["1.0"]
              },
              "sector": {
                "description": "The industry/sector for which this framework is meant for",
                "type": "string",
                "examples": ["Air Transport"]
              },
              "category": {
                "description": "Skills and competency category. (Technical Skills Competency (TSC) or Critical Core Skills (CCS)",
                "type": "string",
                "examples": ["Aircraft Operations"]
              },
              "competencyCode": {
                "description": "Skills and competency code from Skills Framework",
                "type": "string",
                "examples": ["ATP-ACO-4001-1.1"]
              },
              "competencyDescription": {
                "description": "Detailed description of the skill or competency",
                "type": "string",
                "examples": [
                  "Monitor aircraft systems, performance and external environments as well as comply with Air Traffic Control (ATC) instructions and en route navigation requirements to ensure safe and optimal flight conditions"
                ]
              },
              "competencyLevel": {
                "description": "Level of competency / skills: TSC Pro Level (numeric from 1 onward), GSC Pro Level (Critical Core Skills - basic, intermediate, advanced)",
                "type": "string",
                "examples": ["Level 4"]
              },
              "competencyLevelDescription": {
                "description": "Narrative information for this competency level",
                "type": "string",
                "examples": [
                  "Analyse aircraft performance through close monitoring of flight decks to ensure optimal flight conditions during cruise"
                ]
              }
            },
            "required": ["frameworkUri", "frameworkName", "frameworkVersion"],
            "additionalProperties": false
          }
        }
      },
      "required": ["type", "name", "recipient"],
      "additionalProperties": false
    }
  },
  "properties": {
    "@context": {
      "type": "array",
      "description": "JSON-LD contexts. The first entry must be the W3C VC v2.0 context.",
      "minItems": 1,
      "items": [
        { "const": "https://www.w3.org/ns/credentials/v2" }
      ],
      "additionalItems": { "type": ["string", "object"] }
    },
    "id": {
      "type": "string",
      "format": "uri",
      "description": "credential identifier. GENERATED, not supplied: TrustVC mints a urn:uuid at signing time and rejects a document that already carries an \"id\". It is therefore only valid on a signed credential (one that has a \"proof\"), which the conditional below enforces.",
      "examples": ["urn:uuid:0198e4a3-b601-7117-9d02-8c9a9a54ab5d"]
    },
    "type": {
      "type": "array",
      "description": "credential types; must include VerifiableCredential",
      "items": { "type": "string" },
      "contains": { "const": "VerifiableCredential" }
    },
    "issuer": { "$ref": "#/definitions/issuer" },
    "validFrom": {
      "type": "string",
      "format": "date-time",
      "description": "the date and time from which the credential is valid (replaces issuedOn)"
    },
    "validUntil": {
      "type": "string",
      "format": "date-time",
      "description": "the date and time after which the credential is no longer valid (replaces expiresOn)"
    },
    "credentialSubject": { "$ref": "#/definitions/credentialSubject" },
    "credentialStatus": {
      "type": "object",
      "description": "Bitstring Status List entry (W3C VC Data Model 2.0), used to revoke or suspend the credential. All four of type/statusPurpose/statusListIndex/statusListCredential are needed — a partial entry is rejected at signing time.",
      "properties": {
        "id": {
          "type": "string",
          "format": "uri",
          "description": "identifier of this status entry",
          "examples": ["https://opencerts.io/status/1#42"]
        },
        "type": {
          "type": "string",
          "enum": ["BitstringStatusListEntry"]
        },
        "statusPurpose": {
          "type": "string",
          "enum": ["revocation", "suspension"],
          "description": "what setting this bit means"
        },
        "statusListIndex": {
          "description": "position of this credential's bit in the status list; a non-negative integer, expressed as a string per the Bitstring Status List spec",
          "oneOf": [
            { "type": "string", "pattern": "^(0|[1-9][0-9]*)$" },
            { "type": "integer", "minimum": 0 }
          ],
          "examples": ["42"]
        },
        "statusListCredential": {
          "type": "string",
          "format": "uri",
          "description": "absolute URL of the status list credential",
          "examples": ["https://opencerts.io/status/1"]
        }
      },
      "required": [
        "type",
        "statusPurpose",
        "statusListIndex",
        "statusListCredential"
      ]
    },
    "credentialSchema": {
      "oneOf": [
        {
          "type": "object",
          "properties": { "type": { "type": "string" } },
          "required": ["type"]
        },
        {
          "type": "array",
          "items": {
            "type": "object",
            "properties": { "type": { "type": "string" } },
            "required": ["type"]
          }
        }
      ]
    },
    "renderMethod": {
      "type": "array",
      "description": "How a viewer should render the credential. Replaces the OpenAttestation \"$template\": url -> id, type -> type, name -> templateName.",
      "items": {
        "type": "object",
        "properties": {
          "id": {
            "type": "string",
            "format": "uri",
            "description": "URL of a decentralised renderer to render this document",
            "examples": ["https://demo-renderer.opencerts.io"]
          },
          "type": {
            "type": "string",
            "description": "Type of renderer template",
            "enum": ["EMBEDDED_RENDERER"]
          },
          "templateName": {
            "type": "string",
            "description": "Template name to be used by the template renderer to determine the template to use",
            "examples": ["TRANSCRIPT"]
          }
        },
        "required": ["id", "type", "templateName"]
      }
    },
    "proof": { "type": "object" }
  },
  "required": [
    "@context",
    "type",
    "issuer",
    "validFrom",
    "credentialSubject"
  ],
  "additionalProperties": true,
  "if": { "not": { "required": ["proof"] } },
  "then": {
    "not": { "required": ["id"] },
    "$comment": "An unsigned credential must not carry an \"id\": TrustVC generates it while signing and refuses any document that already has one."
  }
}
