{
  "@context": [
    "https://www.w3.org/ns/credentials/v2",
    "https://trustvc.io/context/render-method-context-v2.json",
    "https://schema.opencerts.io/transcripts/3.0/context.json"
  ],
  "type": ["VerifiableCredential"],
  "issuer": {
    "id": "did:web:opencerts.io:blockchain-academy",
    "name": "Blockchain Academy",
    "url": "https://blockchainacademy.com",
    "email": "registrar@blockchainacademy.com"
  },
  "validFrom": "2018-08-01T00:00:00+08:00",
  "validUntil": "2118-08-01T00:00:00+08:00",
  "renderMethod": [
    {
      "id": "https://demo-renderer.opencerts.io",
      "type": "EMBEDDED_RENDERER",
      "templateName": "TRANSCRIPT"
    }
  ],
  "credentialSubject": {
    "id": "did:example:s99999999a",
    "type": ["Transcript"],
    "name": "Master of Blockchain",
    "description": "This masters is awarded to developers who can blockchain",
    "admissionDate": "2017-07-01T00:00:00+08:00",
    "graduationDate": "2018-08-01T00:00:00+08:00",
    "attainmentDate": "2018-07-25T00:00:00+08:00",
    "recipient": {
      "name": "Mr Blockchain",
      "did": "DID:SG-NRIC:S99999999A",
      "email": "mr-blockchain@gmail.com",
      "phone": "+65 88888888",
      "nric": "S0000001Z",
      "fin": "F0000001Z",
      "studentId": "1232"
    },
    "qualificationLevel": [
      {
        "frameworkName": "singapore/ssec-eqa",
        "frameworkVersion": "2015",
        "code": "51",
        "description": "Polytechnic Diploma"
      },
      {
        "frameworkName": "international/isced",
        "frameworkVersion": "2011",
        "code": "55",
        "description": "(Short-cycle tertiary education) Vocational"
      }
    ],
    "fieldOfStudy": [
      {
        "frameworkName": "singapore/ssec-fos",
        "frameworkVersion": "2015",
        "code": "0897",
        "description": "Biomedical Science"
      }
    ],
    "transcript": [
      {
        "name": "Bitcoin",
        "grade": "A+",
        "courseCredit": 3,
        "courseCode": "BTC-01",
        "examinationDate": "2018-08-01T00:00:00+08:00",
        "url": "https://blockchainacademy.com/subject/BTC-01",
        "description": "Everything and more about bitcoin!"
      },
      {
        "name": "Ethereum",
        "grade": "A+",
        "courseCredit": "3.5",
        "courseCode": "ETH-01",
        "examinationDate": "2018-08-01T00:00:00+08:00",
        "url": "https://blockchainacademy.com/subject/ETH-01",
        "description": "Everything and more about ethereum!"
      }
    ],
    "cumulativeScore": 3.9935,
    "additionalData": {
      "coCurricularActivities": [
        {
          "name": "Crypto-investment Club",
          "position": "Club President",
          "startDate": "2017-08-01T00:00:00+08:00",
          "endDate": "2018-08-01T00:00:00+08:00",
          "remarks": "Top trader (2018)"
        }
      ],
      "npfa": "silver",
      "images": {
        "signature1": {
          "name": "Mr Important",
          "designation": "President",
          "signature": "<-- Base64 Image -->"
        },
        "signature2": {
          "name": "Mr Not-So-Important",
          "designation": "Chairman, Blockchain Faculty",
          "signature": "<-- Base64 Image -->"
        }
      }
    },
    "skills": [
      {
        "frameworkUri": "https://www.skillsfuture.sg/skills-framework",
        "frameworkVersion": "1.0",
        "frameworkName": "SFw",
        "sector": "Air Transport",
        "category": "Aircraft Operations",
        "competencyCode": "ATP-ACO-4001-1.1",
        "competencyDescription": "Monitor aircraft systems, performance and external environments as well as comply with Air Traffic Control (ATC) instructions and en route navigation requirements to ensure safe and optimal flight conditions",
        "competencyLevel": "Level 4",
        "competencyLevelDescription": "Analyse aircraft performance through close monitoring of flight decks to ensure optimal flight conditions during cruise"
      }
    ]
  }
}
